text,category,emotion
 apa deepavali ku paakalaam epdi saaga poreenga nu.... like ur guts to compete with our thalapathy...,unknown_state ,joy
 Thala pakka mass padam vera vera vera levelaa irukka pokuthu adichu thookku,Positive ,love
 Anna ne vera vera vera level na,Positive ,love
 dude thala ku role suit aagala not like amitab bachan,Mixed_feelings ,joy
 Singapore m tranding no. 1  Wow,Positive ,joy
 Bigil update vidura time la ...🤗trailer release panna paathiya ....,Positive ,joy
 Our t64 director  vera level,Mixed_feelings ,love
 Super star rajni kanth sir king in cinema,Positive ,joy
 Sema mass thalaivaaa. Thank u karthiksubburaj sir,Positive ,love
 Die hard sethu fan from Karnataka,unknown_state ,love
 All thala fans like pottingla ?,Positive ,love
 Bigil ah vathu pool ahvathu....this Diwali kaidhi diwali..,unknown_state ,neutral
 Raani anaa god is tamil & telugu cinema,Positive ,surprise
 U kena tungu lebih Lama lagi untuk tau saya,not-Tamil ,neutral
 Outright disaster much like sketch and vaalu,Negative ,joy
 Virat kohli fans tap here,not-Tamil ,love
 Ah..  BGM Veri Yaethuthu,Positive ,love
 Sathiyama Vera leval  thala nad yuvan musical,Positive ,joy
 730k likes reached aairuku pangalingala adichi thookalamaa ‍‍‍‍‍‍‍,Negative ,disgust
 Apdi la nadakathu Nadakavum kudathu (1.33)... Aphaaa veral level... Thalaiya rmb naal ku aprma kovama screen la pakran...,Positive ,love
 Marana mass da     Thalaivar lub,Negative ,love
 Edai la Ajith sir vantha mari irruku,Mixed_feelings ,neutral
 Thala naa Mass  Thala naa Class,Positive ,love
 Yogi babu koko 500k Super star rajinikanth ku 374k tha thu thu entha vayasula ethu thavaiya da,Mixed_feelings ,joy
 Mrng wake ayutu YouTube poitu trailer paathavaga like poduga,unknown_state ,joy
 Pandey...nadikiraru edhukku thae thanthi channel vitu ponigala,Positive ,surprise
 Trending no 2 in Malaysia and Singapore.. Thala no 1,Positive ,surprise
" inga ore oru super star dhan,,,adhu enga thalaivar mattum dhan",Negative ,love
 Oruthar mela viswasam katurathukaga mathavangala enn asinga paduthuringa  final dialogue semma ellarukum purium nu nenakiren,Positive ,joy
 Avara control panunga plz thalaiya yaralayum control pana mudiyadhu ra vena,Positive ,love
" Nalla kadhai erukra padathuku lam trailer ku ivlo alaparai ila, edo cartoon kadhai eduthu vechutu ayyayoo",Mixed_feelings ,joy
 oh my God akhsay sir super,Positive ,joy
 thalivya rajnii Anna style like cheyendii,Positive ,joy
 sweet laam pathathu pongale vachiruvom va,Positive ,disgust
 Yeppa..  Enna screen presence... Oru vela pei padama irukumo..,Positive ,love
 ungalukku vayase agala sitty love u ma,Positive ,love
 Padippa yaaralyum parika mudiyathu thaan aana Vela kedaikunum la,Negative ,sadness
 775k likes just 25k to 800k  Thala fans come on...,Positive ,love
" Love from Japan.  I love Rajnikanth, Amirkhan, jr Ntr and Prabhas.",Positive ,love
" Eppa paaru violence, vettu, adodjadi, idhellam illama oru padam eduthu jeyichi laatunga, young generationa violencelaya oora vachidadheenga",Mixed_feelings ,disgust
 Trailer Nlam Nalla Dhan Iruku Padam Oduna Pothum Chiyaan My FaV,Positive ,disgust
 Suriya anna fans hit like,unknown_state ,love
 Many many many many many,Positive ,joy
 Verithanam vere level . Love u vetrimaran sir,Positive ,love
 Trending lla vanthachu eppa parunga da  Petta paraakkkkkk,Positive ,surprise
 Good wrk team but i hate rajani sir,Mixed_feelings ,joy
 Daivu seidhu. ....asuran...koodamattum... release pannatheenga...apparam...panam...poachu..na... Onnum...sollamudiyaathu,Positive ,surprise
 Yenna padaipuya vaazhkaila paatha sirandha padaipuya idhu padamilla idhoeda thaakam poegala,Positive ,love
 Pirabu and naasar very good acting in Piriyanka tamil movie But aigth and Pandey moka acting.,Negative ,joy
 khatarnak  awesome  i  love it,Positive ,love
 Yow Ennayaa pandringa Ithu kuda views varalana paravaala Remake movie trailer one line Storynu Accept pannalam .,Positive ,surprise
 2.01 min. Rajni changing as Akshay Kumar. Twist.,Positive ,surprise
 Sema trailer .. Neelam eppdi da mela vantha .. VJS: atha keela irukkuravinga kitta kelu da ....,Positive ,joy
 20+ times pathuta thalaivaa..evalo times pathalum pathute irukalamnu thonuthu.,Positive ,love
 Padippu padippu nnu solrangale... Ethanae pearku idhu arasiyal reediya puriyudhu .. Parippe vitte nee kette...,Positive ,love
 My birthday ku release so kandippa ethugagavey paaapa.....,Mixed_feelings ,neutral
 Thala pola varuma  Thala eppavume mass Vera level,Positive ,love
 Thala sema maassss solla varthaye illa,Positive ,joy
" thank u so much , ennoda 2 thalaivargalaiyum onna pakkurathukku  மகிழ்ச்சி",Mixed_feelings ,love
 pppaaaa  enna dialogue delivery ...68 vayasada idhu. ....,Positive ,surprise
 Yar ellam #vaanillrul #NKP first single  Update apram trailer pakka vandhu irukinga,Positive ,surprise
 2 padam ranjith ta kuduthu nasam pantaga.. but now decision turns into right,Positive ,joy
 Thala love u thala love u so much thala niriya niriya dialogue,Positive ,love
 Kya ghatiya mo ie bnaya Hai yr,not-Tamil ,neutral
 I'm thalapathy fan....romba nal kalichuu thala kku nalae padam varaee.podhuuu....manasukku ipodhaa sandhosamahhh irukkuuuu.....,Positive ,love
" Tharamana padam from thalaivar, kartik suburaj & anirudh..ponggal'ku mathe padam lam konjom othingiru..odi pathingiru vararthu thalaivaru..",Positive ,love
 Thalaiva trailer la pathittom kaaliyoda aattatha pathittom merandu poie irukkom inum on screen pakka wait panntrom thalava,Positive ,love
 RIP surjith,Negative ,fear
 Dark la ye niraya scenes varuthey,Positive ,joy
 Super Enga Thala pakka mass cfrm vera leve,Positive ,love
 Super  star super star tha masssss,Positive ,love
 Pakathana pora intha kaalioda atatha... Petta parak....,Positive ,surprise
 Trailer semma ah irrukku  Thala mass,Positive ,love
 thalivaa nee eppoo vumay mass than thalivaa...,Mixed_feelings ,love
 Enadha na Thalapathy fan ah irunthalum..Thala ya pidikum,Mixed_feelings ,love
 Who are all waiting veritthanamaa?hit like...Tmrw mrng kadavul dharisanam,unknown_state ,joy
 Ranjith bro pathukunga ipdi tha superstar padam irukanum,Mixed_feelings ,joy
 Massukku porundhura patthu poruthamum unkittadha iruku. ungakitta mattomdha iruku thalaivan DA...,Positive ,love
 0:16 indha scene ah inu mathave ilaya? Idhu magic da .. scientific illa..  But.. amy .. Iruku..  edho onnu namakaga kaathirukku..,Mixed_feelings ,neutral
 Inda trailer 1m lifetime likes kuda vaangadhu polaa,Positive ,joy
 Boss super star is back in avatar,Positive ,joy
 Rajni RockS.. (By-Fan of Rajni & S.Tendulkar),Negative ,love
 Pacha thewdiya mavan rasini  Nalla Jalra Adinga da TN Naaingala,Negative ,joy
 U1 BGM massssssss verala level thala look semaaaaaa,Positive ,love
 Yaarella Tee Jay note panigeh fans oru like podungeh 🤩🤩🤩,Positive ,love
 omg ragini sir was in darjelling,Mixed_feelings ,neutral
 Thank you Karthik subbaraj sir. Waiting for Telugu trailer,unknown_state ,joy
 Ar Rahman music super sama masssss,Positive ,love
 Yuvan bgm world class level hit like,Positive ,love
 Indha padam nalla irukkum Ana thalapathy 64 mayiru madiri irukkum.hit like,Positive ,joy
 Ram Charan's new trailer 215k likes over 5.6M views....petta 428k likes over 5.6M views....swag level of rajni sir,Positive ,love
 Appadi ea intha-  pad man /tare zameen par itha remake pannuga ippo irruka suitivation ku adopt ah irrukum,Positive ,joy
 Yuvan +thala=deadliest combo... Dialogues  bgmyuvannnthalaaaaaa,Positive ,surprise
 BABL Thala AJITH in serapana Movie vazthkal,Positive ,love
 You are lying lying lying lying,Positive ,surprise
 Marana mass thalaiva atuchi thulpannu thalaiva,Positive ,love
 1:59 - 2:02 vasigaran turns into Akshay,Mixed_feelings ,neutral
 Guys Ellarum Lyrics song commentuku vaanga Katharalgal roba athigama irukku katharikitte irukanuga,Positive ,surprise
 Movie paaththiddu   tailer pakravangka like podungka,Positive ,joy
 August 10 tharamana sambavam iruku kathiruppom,Positive ,surprise
 Akshay Kumar ku bathila Siva Kumar ah potrukanum thappu pannitanga,Mixed_feelings ,neutral
 Thalaiver padam vetri adaiya thalaiyin rasikarkalin vaalthukkal,Positive ,surprise
 Intha trailer trending nu soldravanga oru like ting ting panugo,Positive ,joy
 Ita yavudu release panna udunga ya,Positive ,joy
 Saaho oda remix ah shakthi man ah,Mixed_feelings ,neutral
 End Fight Vere level,Positive ,love
 Thoongi Enthiracha vudane evlo million views nu paka vanthavanga like podunga....,Positive ,joy
 Style ah irukeenga.   athu natural ena word ya Athu,Positive ,surprise
" Self made superstars in India rajini kanth,chiranjeevi, amitabhachan",Positive ,disgust
 Manju warrier Vadachennai Andriya vuku duff kodupanga pola,Positive ,anger
" Looks like good but engeyoo lag agramadiri irukku,papom",Mixed_feelings ,joy
 N.k.p no.1 trending  you tup srilanka thala  pakka mass,Positive ,love
 Hey kaithai deepavali ku film release pannitama floop ayidim..annan verithanam realised....pongaluku relise panniko polachikuva,unknown_state ,love
 Trailer Ra ore varthaiyil sollanuna Gommala trailer appadi Rikki,Positive ,surprise
 Thalaaaaaa nee vaa thaaaalaaa senjivitruvom.......,Positive ,surprise
 Semme mokka doi. ha ha ha kubeer nu sirichavan ellam kai thooku,Positive ,disgust
 Theriiiiiiiiiii maxxxxxxx.....Best wishes from thalapathy fans,Positive ,love
 sweet sapda porom vera evan soli irundalum ivlo mass ah irundirukaadhu.. the name is SUPER STAR,Positive ,love
" Oruthavanga mela ulla #Viswasatha kaatta, innoruthavangala #Asingapadutha koodathu.... Semma Line....",Positive ,joy
 Our Lady Super Star  Manju Warrier,Positive ,joy
 After infinity war ungaa trailer kudaa pakka pudikalaa,Negative ,fear
 Smjh me kuch ni aaya but acha lga dekh k trailer Rajni sir ka,not-Tamil ,neutral
 hahahha bilgil kitten modate venna  kaithi patukooo,Positive ,joy
 Vetri maaran  & Dhanush Is best,Positive ,surprise
 Next vijay movie...logesh kanagaraj kooda dhan da.....   Apo yar gethu..... Nu yosi.....,Positive ,surprise
 Ippadi neraya neraya neraya neraya Thala fans From Malaysia,Positive ,love
 Trailer partaale terithu next year #Thalapathy64 epdi irukum’nu    veritthannnaam!!!,Positive ,love
 Thalapathy 64 Ku Wait Pandravan Like Adi .....,Positive ,joy
 Ennagada 3naal appram ternding lla variga,Positive ,love
" Kya yaar koi aur kahani nhi mili thi, already is kahani pe film pink bn chuki h",not-Tamil ,neutral
 Vera level. super star Ragini  fans like hit,Negative ,love
 Yuvan Vera level thala ne ..,Positive ,love
 Rangraj Pandey  Ennaya Pandra Court la ?! Over aah Pesuna Court aah Vittu Kuda Thorathida Poranga 🤭 ..,Positive ,love
 Hahaha back to 90s rajini sir... Waiting thalaivaaa,Positive ,love
 Bigil oobittu pooga vendiya neeram vandhuruchu,Negative ,fear
 neee thepavaliki thalapathy kuda vara namakida un  mass edipadathu mapulla,unknown_state ,love
 Padam verti para thalapathy fans sapaka vailthukail,Positive ,love
 Thalai awesome... Vera level... Vaa thalaivaaaaaaaa,Positive ,love
 I am first like and viewer,Positive ,joy
 Yuvan bgm vera level ...paaa grt composer,Positive ,love
 Super star is back... Pakka blockbuster ## thank u karthik subbaraj,Positive ,joy
 Oruthavanga mêla viswasam kadurathukaka en inoruthara asinga paduthuringaaaaaaaa best ever dialogue thala,Positive ,joy
 I set your screens on fire.... Thalaivaaaaaaaaa....,Negative ,love
 Ayyo yepdida ipdilam yappa marana mass da sama veriya iruken nalla thramana sirappana padam paka,Negative ,love
 6 days ah srilanka la trending 4 kulla thaan itukku,Positive ,surprise
 Diwali winner  Kaithi.  Like  Bigil.   Cmt,Negative ,joy
 Climax dance ultimate thaivar kaaga waiting vaa thailaivaa pongalukku ponga vachiruvam,Positive ,disgust
 HiNdI version,Negative ,fear
 Verithanam trailer nampa education mattum nampa keta irunthu yarum vanga mudiyadhu  True words,Positive ,love
 6 o clk la irunthu continuous  parthute irukuravanga like ah potutu ponga,Positive ,joy
" 92k views but 142k likes, how is it possible 🤯",Positive ,joy
 Thalaivaaaaaaaaaaa........ Semma mass.... Pongal ku theatre summa aththirrrrum,Positive ,love
 Isse 1000000 times better h zero ka trailer,Negative ,anger
 Sk masss vera lvl trailer,Positive ,love
 petta in  malayalam means badass and kaali is,Positive ,anger
" vijay sethupathi anna ku trailela seriyana scene ila,vijay sethupathi anna ku innum mass scenes irukanum movie la",Positive ,love
 39k views but 44k likes. How?,unknown_state ,joy
 Ennagada 81k views 97k likes,Mixed_feelings ,joy
 #Movie Vera Level Sir 100% True naan unmayilaye mersalayitten Ozm movie,Positive ,love
 so bollywood is 70 years behind hollywood?,Negative ,sadness
 Enna Da Bomma padam maathiri irukuthu,Positive ,joy
 Thala thala thala va aaaaaa vaaaaa thala..Love youuuuu so much Thalaaaaaaaaaaaaaaaaaaaaaaaaaaa,Positive ,love
 1:37 thala_style.. This scene matum 10times mela paathvangaa yaarelam...,Positive ,surprise
 Padam verithanam nu solranvanga like pannunga,Positive ,love
 KK na yaaru? Kamal and Kenny,Positive ,love
 అన్నయ్య.... తెలుగు లో కూడా చేయండి అన్నయ్య... మూవీస్ ప్లీజ్ అన్నయ్య,not-Tamil ,neutral
 Thala neenga Trending no 1 laye thangiteengala...,Positive ,joy
 All the best from rocking star Yash fans karnataka,Positive ,love
 Dislike potavanuka amma va oda vittu okanum,Negative ,joy
 Dialogues nachu nachunu Vera levela erukku,Positive ,love
 Wow 40k views and 39k likes,unknown_state ,joy
 DHANUSH FANS -----  LIKE HATERS OF DHANUSH ------------ COMMENT         ANY WAY BLOCKBUSTER FILM OF 2019 #ASURAN,Positive ,love
 Sridevi Daughter Khushi Kapoor Met Ajith,Positive ,joy
 Thala semma Meratitinga Thala love u,Positive ,love
 1million like varum solluravaga like pannuga,unknown_state ,joy
 Trailer mokka da karthi punda magane,Negative ,disgust
" Pongalukku enna panna porom, Petta parkaporom",Positive ,surprise
 Itho vanthutanga ..athuku like podu ithuku like podu nu,Positive ,joy
 Savage....Oruthar mela neega vishwasam katradhuku inoruthara yen asinga paduthuringa,Positive ,joy
 Aiyoo thala Aug 10 varaikum wait pannanumey.... Nee vaa thala,Positive ,joy
 Nerkonda PAARVAI Trailer Vera level  SEMMA MASS,Positive ,love
" You kena tunggu lebih lama lagi untuk tau saya , Chiyaaannnn Vikrammmm",Positive ,disgust
 Elaam Avan seyal part 2 vaaa,Negative ,disgust
 Enakenumo like Kaala padam maari than thalaivaruku set agumonu thonudhu,Mixed_feelings ,love
 Shankar sir  ur a legend,Positive ,love
 Thala Yoda last dialogue sema mass vera leval,Positive ,love
 Film kamal ki lag rhi h,not-Tamil ,neutral
 Rangaraj pandey FANS hit like here,Positive ,love
 VA Thalaiva ?  a style you are a massive style king  love you,Positive ,love
 Rajini sir marana mass  I am thalapathy veriyan,Positive ,love
 Thala  a sami  I am wit,Positive ,surprise
 i am dhanush veriyan da  mass vera level,Mixed_feelings ,love
" Editing average ah iruku, hope movie la paakumbodhu nalla irukumnu",Positive ,joy
 Kola gandula irrukuken mavaney kollama vida maten mass Thaliava,Positive ,love
 Yen sir arasiyaluku vantheenga ungala mulusa rasika kooda mudila... You are a great actor.,Mixed_feelings ,neutral
 Theme song same like thala nerkonda paarvai 🤔,Negative ,joy
 Ipo trailer pakkuravunga like pannunga 2.04 am,Positive ,joy
 Vera level I am dhanush big fan,Positive ,love
 Mr.Vandu Court la ipdilam kaththa kudathu...,Negative ,sadness
 Mass Patta .  Rajini sir,Positive ,love
" trending #1 in singapore...superstar maaaass,marannna maaasss..",Positive ,joy
 44k dislikes......verithanama kaathu kedanthurupanunga pola   But 530k likes.. ithukku munnadi antha 44k dislikes   Kaanaama poiduchi,Positive ,love
 I love vjs,Positive ,love
 Thala  orutharukku thaa like  vera yarukkum eilla  thala tha,Positive ,joy
 Super super  RAJINI makkal mandram Tiruppur district DHARAPURAM,Positive ,joy
 Ellam avan seyal part 2 va,Positive ,surprise
 Evalo Peru pink Trailer parthinga like podunga,Positive ,joy
 Super .... star...  chitti ..... rockzz....,Positive ,disgust
 Enna pa  bat man ah,Positive ,joy
 Mass ah ellama mechured ah actpanirukaru #thala ana athuve bayangara mass ah erruku,Positive ,love
 Vetrimaran standard ku illadha madhiri iruku,Negative ,disgust
 Kanmadham cinemayile manju chechiye orma vannavar undo?  Love from Kerala,Positive ,love
 Marana mass trailer 6 appuram 7 da namma super star munnadi yavanda ore star athu super star,Positive ,love
 Neraiya neraiya neraiya masssss ah irukku,Mixed_feelings ,love
 Super thalaiva.... Nee mass dha eppavume,Positive ,love
 Sema vera level ma. Love u so much,Positive ,love
 Enikikulla 10m agunnu naikiravaga like podunge,Positive ,joy
" Kaththi , poojai maari  Bigil , kaithi hit aagum",Mixed_feelings ,neutral
 Kozhandhaila vellaya iruparam.valandha karupa iruparam.idhudhan avaroda super power ah.indha logic ah epo da mathuvinga,Negative ,joy
 Vijayku competition ah vittu jeicha paathiya. Anga nikkura,Mixed_feelings ,neutral
 1:19    teejay,Positive ,surprise
 Sk anna & arjun sir mass ... nice trailer super vetri pera namma team ku vazthukkal,Positive ,love
 Chiyaan Mass ka Baap... Agree,Positive ,love
 My all time favourite Hero sk Anna 🥰🥰🥰🥰🥰🥰🥰🥰,Negative ,fear
 Thalaivar epovum mass dha sk anna love u anna,Positive ,love
 srilanka vijay veriyan da ..!!,Positive ,surprise
 Shankar hatsoff to you sir .,Positive ,surprise
 Older me ---- engineer aganum miss Me know -----  Yedhuku engineering padicheyno,Mixed_feelings ,neutral
 Trailer semma...Next Thalapathy movie ipdithan mirattal ah irukapoguthu...,Positive ,joy
 Thala vera level... Innum nariya nariya naraiya venum.,Positive ,love
 vivasam laa avlotha ippo petta tha mass,Negative ,love
 Karthi vere lvl Evan anu serikum suryade chettan,unknown_state ,neutral
 Trouble treat makkal selvan fans like it,Positive ,love
 Oruthar mela neenga viswasam katrathukaga innoruthara yan asingapaduthuringa   Love you Thalaaaa,Positive ,love
 Pink nu hindi la vantha thoda tamil remake ah??,Positive ,surprise
 tom and jerry ethinna kallum kollam...,Negative ,disgust
 Oru periya nadigarukku indha padam set Aagadhu.. I think vera ?,Mixed_feelings ,neutral
 Last dialog mass varaleval thala YSR music varaleval thala,Positive ,love
 Trailer pakrathuku munadiye like potavanga..hit like,Negative ,joy
 U1 bgm  pedichavanga like panuga,Positive ,joy
 Paakaruthukku style aarukka???? Antha ponnukku kannu yengey..kundiyiley vechirikkeyaa,Positive ,disgust
 kya look diya he vai ne,not-Tamil ,neutral
 Nerkonda paarvai Mix with Viswasam BGM,Mixed_feelings ,neutral
 Bgm kaga mattum repeated mode ah paakuravangala yar yar sollunga...,Positive ,surprise
 Yana sola mara massu kudu paru na nanikavala bgm vara level I love dhanush Anna,Positive ,love
 Enthaa Trailer pathaa yaaruku KGF   Flash Avudhu,unknown_state ,neutral
 Last dialogue indirect ah bigil ah solra madhiri iruke,unknown_state ,neutral
 10 varusham ulla irunthen nu mattum thana sir theriyum..... 10 varushathukku munnadi enna pannittu irunthen nu theriyathulla ......,unknown_state ,neutral
 TONIGHT KULLA 10 MILLION VIEWS KANDIPA VARUM AGREE?,Positive ,surprise
 Zero - Movie Ki To Vaat Lagne Wali he,Negative ,sadness
 Epavume ajith oda own dialogue padathula pota padam flop tha...paapom director sona mari nadichurukara ila ivarukaga kadhaiya mathirukangala nu...,Mixed_feelings ,neutral
" Saavuradha irundhalum sanda potu saavanum, Bayandhu saaga Koodadhu  Apt for Diwali Release scenario",Positive ,surprise
 Ena pa.. Sollama kollama... Posukunu release pannittinga...,Mixed_feelings ,neutral
 petta paraaak.......watching the trailer continuously. Marana massssss...  RAJINISM da. Pongalku tharamaana sirapaana sambavam,Positive ,love
 Thalaiva Your Veera Level Marana Mass,Positive ,love
 thanga tamil mannan enga thala daa,Positive ,love
 2.18 sweet sapda porom ..semma thalaiva...... blur background arumaiyaana edit,Positive ,love
 Seeman annan'in mind voice Yaarya nee? Enakke unna paakanum pola irukke.. :),Positive ,joy
 Padathoda cg pathi pesunavankaluku sariyana adi,Mixed_feelings ,neutral
 Aiyo sami antha dance movement kevalam da sami... Sirupa adakka mudiala🤣🤣🤣,Positive ,disgust
 This concept looks like arjun suravaram movie in telugu,Mixed_feelings ,joy
 Super trailer . Hit aga podu target 3M likes,Negative ,joy
 Aiyo aiyo aiyooooooooo thala kola mass eh,Positive ,love
 ennada ithu you tube trendingla kooda illa 🤣🤣,Positive ,joy
 Sema mass Pongal kku wait pannunravanga like panunga,Positive ,love
 Apdla nadakathu.. Nadaka kudathu..  #Verithanam,Positive ,love
 Va thala va thala va thala therikaviduvom pattasa pola,Positive ,surprise
 Thaliava vera level super pakka semma mass,Positive ,love
 Ithuthan ya naanga kekra Rajini  Get Rajinified,Negative ,fear
 Robot kuda romance pannuthu singles nangalam saga vindithu tha polla,Mixed_feelings ,neutral
 Epo dha trailer sudu pudikira madhary thonudhu,Mixed_feelings ,neutral
 Thala + U1 combo...vere level daa...,Positive ,love
 Thala vera level...3.3k vijay fans pathurukanga...lol,Positive ,love
 All d best from power star punithrajkumar  and Vijay devarakonda fans,Positive ,love
 Visvasam 20+ Million views thandi poitu iruku..🤩🤩🤩🤩,Positive ,joy
 Janaavukku pottiyai Super star Rajani. Mudinthaal moothippaar. 2.0 seri varaa Janaa thaan seri varum.,Mixed_feelings ,joy
 Paiyan ah vida Appa mass dhan,Positive ,love
 1 weeks mela agiyum 11M view tan     Marana mokka,Positive ,disgust
 Appo bigil ku ippo allu vitturkumey to be Frank pakka mass and pure hit no doubt,Positive ,love
 Iwanallam yaar wantha act panna sonna...  kilattu punda maathri irukan..  ithallam paarkanumda naan uyirodu irukan🤫🤫🤫🤣🤗,Negative ,love
 No paid views no paid likes..  Still Trending no 1,Positive ,joy
 Yarela 500 k like ku wait pandrenga like here  Thala bloods,Positive ,joy
 Yr Kamal Bht W8 Kya tha is film k trailer ka Or aj us w8 ka pagl Milgya,not-Tamil ,neutral
 World wide you tupe trending no#1   Nerkonda paarvai... Mass katriga thala..,Positive ,love
 Movie Chancey Ella yuvan songs and music unna Vida Vera yarum evlo Nalla pottu eruka mattanga.....love u Thalaaaaaa,Positive ,love
 Pink ki debu movie bt okkk Jo agry ho like & comment kre,not-Tamil ,joy
 Thalaiva acting vera level bgm kola mass blockbuster dha no doubt hit like,Positive ,love
 Annai kalikambal movie vfx is better,Mixed_feelings ,neutral
" Ennnada ending la thee mugam song lite a keekuthu..,",Positive ,love
 Padam pathathukku appuravum trailer pathavunge like podunge  fan from kerala,unknown_state ,love
 VANTHAL RAJU AH THAN VARUVEN KU pochuku samam daa NKP,Negative ,anger
 Super... Kaththi music vera climax la varuthu,Mixed_feelings ,joy
 allu vittruchu thalaivaaaaaaaaaaaaaaaaaa..... ithu than marana mass.... mathavanellam waste.........,Negative ,love
 Thala Maassss  end Semmaa Dailogue....,Positive ,joy
 pesi pesi time waste pannama trailer views increase panna parunga,Positive ,anger
 Ithellam yaarala siva aalaya illa arjun aalaya y1 uhhhhhhhhhh,Positive ,joy
 Neraya neraya neraya neraya likes  awwesome teaser,Positive ,joy
 evanno engayo semmaya asigam pathurekan,Positive ,love
 Nambika vanthutu...karthikey ipdina thalapathy ku...verithanama irukum polaye..jolly trailer allu vudanum thalaiva..,Mixed_feelings ,love
 Verithanama irukku  Tamil a Hollywood,Positive ,love
 Seth'a sanda potu saganam mass dilouge .....,Negative ,love
 Mass dialogue was apdi ellam nadakkadhu nadakavum kudadhu,Positive ,love
" This caste movie maari irukku,,,, ethukkku",Positive ,joy
 Intha pride Indian movie trailer ku 34k dislikes vanthathu epdi da ipdi intha trailer Ungaluku dislike panna thonichi,Mixed_feelings ,disgust
 Naan vijay fan but super starkku head's of ithu thalaivar padam sema mrana mass,Positive ,love
 My real god in my life,Positive ,love
 hindhi at last ? enna solla varinga ?,Positive ,joy
 Rajini fans hit like here,Positive ,love
 Oruthar Mela Neenga Viswasam kaatrathukaga Innoruthar enn Asinga paduthu ringa,Positive ,joy
 1m likes varumnu solravagga like here,Positive ,joy
 Maranam Massu maranam Athukku Thala Tha Poranthu Varanum; I Love You Thala,Positive ,love
 Bigil oda kaithium verithanam   ah irukka vazhthukkal,Mixed_feelings ,love
 I love u  thalaaaaaaaaaaaaaaaaaaaaaaaa  Nega Vanga thala  therikkavidalaaaaa,Mixed_feelings ,love
 Marsal bgm I love Sam cs,Positive ,love
 Block Buster confrom nu soluravaga like podunga,Positive ,joy
 Dhanush & Manju varier Combo..,Positive ,joy
 Vera Vera Vera level maranam,Positive ,love
 92 k views but 134k likes ????,Mixed_feelings ,joy
 Pandey acting nallairukunu sollravunga like buttona tattunga,Positive ,joy
 Asuran Padam koothi mari iruku neega bigil kuda poti podrigala..bigil da,Negative ,anger
 Pink movie hi lag rahi hai,not-Tamil ,neutral
 Rajinikanthin verithanama rasigargal ethana peru erukinga,Positive ,love
 OMG...!!!!!!!!!  M speechless..!! Thalaivaaaaa  No one like u..!!,Negative ,love
 Saamy 2 - no Trisha 2.0 - No Aishwarya rai  Anyways Shankar & Rajinikkaga paapom,Negative ,disgust
 Apdi ellam nadakadhu nadaka koodadhu thala ne va thala ne va thala,Positive ,joy
 Who saw Telugu rangastalam Ram. Charan shades in Danish like here,Negative ,joy
 Eegarly waiting for the movie thalaivaaaaaaaaaaaaaaaaaaaaaaaaaaaaaaaa,Positive ,love
 August 10 Vera level treat erukku thala fans,Positive ,love
" Ada paavigala #Bahubali VFX alavuku kuuda varalaiye da,.",Mixed_feelings ,neutral
 Yellam ok  Ore oru korai Trailer komjam munnadiye poturkalam,Positive ,joy
 Thalaivar so young 🥰🥰🥰🥰🥰 yaru da sonnathu vayasaairuchen nu,Negative ,love
 Vaa thalaiva vaa thalaiva vaa thalaiva .. ennode thalaivar chumma pinraaru .. semme mass..,Positive ,love
 Yeh 2018 mai bani hai ya 8102 mai,not-Tamil ,neutral
 Trailer verithanamnu solluravagga  Like and Comment pannugga pappom  Karthi in kaithi vera level,Positive ,love
