text,category,emotion
 Kadaram Kondan south indian cinema Vendran engal chiyaan vikram,Positive ,disgust
 Adda adda da rajni sir rajni Sir da super superooooooo,Positive ,joy
 Inthaa year namaku 2 deepavali 2 pongal....,Positive ,love
 No 1 trending again Vara vainga friends,Positive ,surprise
 kelatu punda makaluku oru nalathu panala suyanalavathi pundaaa mavan,Negative ,disgust
 THALA I love you Marana Mass,Positive ,love
 I think it is same like pink movie.,Positive ,joy
 Akshay Kumar fan's like kar do,not-Tamil ,love
 Enaku apdiye padaiyappa second half Rajini ya patha mariye iruku  can't wait for fdfs,Positive ,joy
 Ithu muzhukka muzhukka thamizhil eduka patta oru aangila thiraipadam,not-Tamil ,neutral
 Karumam Maari irukku Ajith oda dialogue delivery,Negative ,disgust
 Rajani same pavankalyan attitude la untundi,not-Tamil ,neutral
 Mass sk Anna vera level I love Anna padam vera levela irukkua poguthu,Mixed_feelings ,love
 Vikram Sir u r a pure fire,Positive ,joy
 Tamil natla chiyan sir ahla mattum than ipadi hollywood range la nadika mudium ithu unmathanee,Positive ,disgust
 Epo trailer pathuttu erukinge like podunge,Positive ,joy
 Padam partha pinnadiyum trailer semmaiya iruku,unknown_state ,neutral
 Semmmmaaaa masssss ss thalaiva..... Dialogue ella mirattal,Positive ,love
 Ennada ipadi yeduthu vechurkingha ......paaaaaaaaaph,Negative ,disgust
 G.V.P paithiya kara nee mooditu Music eh podu  Maallaaaaa Bgm,Positive ,joy
 GV prakash in Bgm padathuku extra strength,Positive ,love
 Sivakumar sir iruntha Ella phone ayum thativitu kathaya mudichirparu,Positive ,disgust
 Kuch samajh nhi aaya per trailer dekh kar yesa laga pink movie ka remake hai,not-Tamil ,neutral
" Nammakitta kaadu irundha eduthukuvanunga, rupa irundha eduthukuvanunga, padipu irundha yavanalum edukamudiyadhu.....",Positive ,joy
 Ennada  “ellam Avan seyal “ movie remake ka?..,Positive ,surprise
 No 1 trending in Sri Lanka,Positive ,surprise
 Remake of (pink Bollywood movie) Yanna raaskala mind it,Negative ,fear
 Rajinikanth and Akshay kumar  Ke fans hit likes.........   Superhit trailer......,Positive ,love
 What did you say Mrs.Meera Krishanana Ippudi neryea Neryea Neryea...,Positive ,joy
 Shankar oru scientist nasa la work panna vendiya varu cinimala work pandraru.,Mixed_feelings ,neutral
 Pakka mass is my super star,Positive ,love
 July1 20M vivews varum 1M likes um senthu varum,Positive ,joy
 chiyaan vikram hindi fans like here,not-Tamil ,love
 petta petta petta petta petta petta,Positive ,surprise
 Eyyyyyy inda no1 no2 ellam paapa vilayattu  ennakume thalaivar than no1 super one understand,Positive ,love
 Azalagana styleah na  Rajini... Remembering his love flims..,Positive ,love
 Thala August padam vatatum namma mass katrom..,Positive ,love
 Yarellem notice panninga  seathupathi bgm in sangatamilan,unknown_state ,neutral
 Karthick Subbaraj unmayana thalaivara veriyan nu katitinga great...thalaivar Style la solnamna hats off karthick,Positive ,love
 Ena da apo apo viswasam theme varudhu,Negative ,disgust
 thala tha ennoda uyir daa   ajith Anna neega vera leave,Positive ,love
 Am thalapathy veriyan  Anna asuranuku marana waiting,Positive ,joy
 Vijay & SK Mutual Fans Like pannunga...,Mixed_feelings ,love
 Ipppadi neraya neraya neraya vera vera vera level,Positive ,love
 Vfx work is Awesome like Hollywood movie,Positive ,joy
 Thala vera vera vera level,Positive ,love
 August la padam varatum Nama than gethunu kamikkurom,Positive ,surprise
 Sorry pa Hollywood pakam vandite pola,Positive ,joy
" 2:10 ""jeikaromo ilaiyo.... mothala sanda seiyanum"" ....resemblance",unknown_state ,neutral
 #1 trending in #Srilanka  #3 trending in Malaysia  #9 trending in India,Positive ,surprise
" Priyanka ,ellam avan seyal pola ullathu",Negative ,anger
 Super star ka super style,Positive ,joy
 Ithukkum dislike podravangala nenacha than,Positive ,joy
 pwli ..  കിടു ..  anyayam,not-Tamil ,neutral
 nerkonda paruvai ipdi vaikkanum nalla Tamil Peruna.,Positive ,joy
 Bigil ku pee pee ya oooooo oooooo,Negative ,fear
 Enna da kadaisila kaththi bgm varthu,Negative ,sadness
 Orutharu mela viswasam katthurethu kaage yen ennoruthareh aasingam paduturingge!!!,Mixed_feelings ,neutral
 Vera level la iruku... Waiting for release,Positive ,love
 bgm kgf bgm modified mathiri iruku,Negative ,sadness
 Tharamaama sambavam irukku 6 clock ku   Kaathiruppom,Positive ,love
 Let's make the likes to 1.2 million likes,Positive ,joy
 Kaala na mass aah irukkanum  Kaali na massum classsum irukkanum,Positive ,love
 dislike potavanlam..... Setthuru..... summava Bigil team late release ku paechu vaarthai nadathinaanga... Trailer therkidhu.. Sure shot saravedi,Negative ,joy
 1m views =500k likes Now 4.6m views = still 580k likes  Something wrong,Mixed_feelings ,joy
 This moive like Sri hari's Telugu movie Sri mahalashmi,Mixed_feelings ,joy
 Sk padam trailer ah vida ithu Semmiya Iruku,Positive ,love
 Thala fans ellm trailer like pannunga bro,Positive ,love
" Rajini eh vaee sight adikaavechtangalaee..he looks handsome ,..makeupartist",Positive ,surprise
 Semma semma CG AND SEMMA BACKGROUND,Positive ,joy
" u kena tunggu lama lagi untuk tau saya, you have to wait more to know who I am....",not-Tamil ,neutral
 Odi pathugiru vaarthu thalaivarin petta !!! .... parak,Positive ,love
 Bigil koodaye modhurapdi adhu .....   Idhuthanda verithanam,Negative ,love
 Naan oru thalapathy fan aanaa naan 100times mella paathirupan...aaana likes views romba kammi,Positive ,love
 Love u dhanush anna semma massss,Positive ,love
 Bgm from 0.38 to 0.58 vere level,Positive ,love
 ಐ ಲವ್ ಯು ತಲೈವಾ... Superstar...  only  one.... ರಜಿನಿ ಕಾಂತ್,not-Tamil ,joy
 Thala time agiduchi kannu eriyuthu tomorrow vanthu ungalai parkkiren Thala I love you,Positive ,love
 Semma trailer paka mass !!,Positive ,love
 Likes yaru vanguranganu mukkiyam illa box office than mukkiyam athula thalaivarae adika mudiyathanu pari right hit like,Mixed_feelings ,love
 Ithuvum kadaikutty Singham Mari jathi padama?🤔,unknown_state ,neutral
 National award miss aagathuu indha time,Positive ,surprise
 On fire thailaivar...sirapana tharamana sambavangaka inime thaan pakaporinga,Positive ,love
 Crime side movie am love it.RATCHASAN mathiri irukkunumnu aasapadraah...,Positive ,love
 Angali pangali anaivarukkum Kalai Vanakam,Positive ,joy
 adithya varma - Kadaram kondan  rendum onnukonnu salachathilla  appavum pullayum kalakuraangale daily yar videova 1st pakrathunu doubt varum,Positive ,joy
 Daiiii dislike poturanga koinjam pathutu potunga da,Positive ,joy
 Petta 10 thadawaiku mela pathavaga like pannuga,unknown_state ,joy
 Teejay fans like here 🥰🤩 I love teejay songs,Positive ,love
 Yappa Vera level pa marana waiting,Positive ,love
 Trailer itna mst hai to movie kitna gjb hoga yaar,not-Tamil ,neutral
 Kaithi audience responce.   Pls subscribe,unknown_state ,neutral
 Thalaivaa..... Love uno words hyo paaaah🤩🤘,Positive ,love
 Oruthar maela viswasata kamika innoruta asinga padata kudadhu sema dialogue 🤘,Positive ,joy
 Thala yoda ovevoru dialogue delivery um sema mass vera level Goosebumps overloaded,Positive ,love
 viswasam Ku irundha opening iduku illa y🤔.still only 10 M.viswasam trailer 14 M in one day.edo onu miss aavudu,Positive ,joy
 Neenga velayadanathu enkitta illa yeman kitta  Only one dialogue is enough  chiyaan uyir,Positive ,love
 super star king of kings forever,Positive ,joy
 Nivetha suit aachu ...But rashi kanna nalla illa....,Mixed_feelings ,joy
 Ellam avan seiyal nu oru padatha nyabaga paduthudu,Mixed_feelings ,neutral
 Yaarukellam Kabali and Kaala pudikkum...,unknown_state ,neutral
 Like karo share karo Apne what's up grp me,not-Tamil ,joy
 Diwaliku varama eruntha good elladi summa vasool kuranji flop akathan,unknown_state ,joy
 Rajni sir hain to aur kuch nahi chaiye.,not-Tamil ,neutral
 Surya annan uyirr & karthi annan chank,Negative ,love
 Simple Ah sollanumna Kola Mass Trailer Enna Acting ya manushan,Positive ,love
 Ner Konda Parvai.. Thalaku Suitableana Title,Positive ,love
 Who all agree Vijay sethupathi ku inda mari dance set aagala nh,Negative ,sadness
 Pink movie ka remake lag rha hai,unknown_state ,neutral
 pollachi matar  nakeeran kopal in sapot  dialog,Positive ,disgust
 Pool maari irruku padam omna dhan podhu,Mixed_feelings ,neutral
 Kaithi-ku CONGRATULATIONS  T-64 ku ALL THE BEST.,unknown_state ,neutral
 1 like nawaj bhai k liye,Positive ,joy
 19.2k views to 12M  ......,unknown_state ,neutral
 Thalaivar cinema la irukura varai avar thaan eppoum ennaikum Super,Positive ,love
 Intha Super Star thaaan engaluku venum  90's kids fav,Positive ,joy
 kochadaiyan football adraaru anga oru trailerla,Positive ,surprise
 @1:40 enna harris bgm lam varudhu :) ?? Therikkudhu Yuvan bgm..,Positive ,joy
" Sarkar teaser record safe🤗  Naanga Telugu teaser and Hindi teaser potta , neenga kaaaname poyivudum",Positive ,joy
 Yo eth vand anyama erkk lle,Negative ,sadness
 Thala fan nu sollum pothu perumaiya irukku,Positive ,love
 appadiye ean channel ku oru sub podunga,Positive ,love
 Pls guys make it 1m likes....,Positive ,joy
 waннн waннн waннн тнala тнala тнala   enge тнala nale мaѕѕ тan..  ѕeммeeee,Positive ,surprise
 Dai Viswasam teaser enge daw,unknown_state ,neutral
 Yuvan Fans    Hit Like,Positive ,love
 Hero vera yar na podunga pa plz,Mixed_feelings ,neutral
 To haters in Lollu sabha style : Arivu ketta eruma maadu,Negative ,fear
 Paah samma well known dialogue well said padippa yaralayum thirida mudiyathu,Positive ,surprise
 1.8 m reach sema eppadina 100m Vara vekkano,Positive ,joy
 I love u thalaiva neenga eppavum mass nee va thalaivaaaaa,Mixed_feelings ,love
 Thelivaaa marana mass ah iruku,Positive ,love
 mass's INA ethu thanta thalaivaruta othunguta,Positive ,love
" Trailer nalla iruku, padam nalla irukanum.... ambutu than solliputten",Positive ,joy
 Thala mass yuvan bgm vera level suriya fan,Positive ,love
 Dislike pottaven la ratham kakki saven,Negative ,joy
" Sema trailer cinematography therikuthu, bayangaramana oru mass plus thriller movie kaathuttu irukku.",Positive ,love
" Orutthar Mela viswasam kaadrathala .....  Innorutthara Yan asinga paduthureenga .....  Dai ungalathanda THALA ,THALAPATHY FANS",Positive ,love
 Rajani style is style style dance is dance,Positive ,joy
 Enna karumamda ethu cartoon padam mari erukuthu,Positive ,disgust
 Dey idhukku yenda dislike pandrinka . Trailer semma mass ah entertaining ah thanae irukku.. vaitthu yerichallin uccham da neenka,Positive ,love
 Inime than sirappana tharamana sambavangala pakka poringa..... Best wishes for thalapathy fans,Negative ,love
 செம்ம சியான  மரண Waiting for kadaram kondon movie,Positive ,joy
 Trailer 1million like varalanu yaarellam feel panringa,Positive ,joy
 🤖Thalaiwa is god !! Or ???? Plz rajinikant sir ke fan ho to   . Touch to !!!,Negative ,love
 Darbar motion poster pathutu vanthavanga yaru,unknown_state ,neutral
 Super man and Batman movie Mari iruku,Positive ,joy
 Aapdilam nadakathu !!!! nadaka kudathu  ultimate lines,Positive ,love
 Marana mass thala na thala tha,Positive ,love
 Ending speech mass thalivaaaaaaakola kandula iruken,Positive ,love
 0.48  0.49 thalaiva unakku vayasu 53 yaaa🤪,Positive ,love
 Kaali... Kaala... Kaabali...  thalaivar da... Kaa romba rasi nenaikuravaga like poduga,Positive ,love
 Paakathane poringa thalaivaroda maasa petta parak,Positive ,love
 9m view innum neray neray neray  view vennum friends,Positive ,joy
 #2.0 in kannada dubb tamil movies in kannada,unknown_state ,neutral
 Always Thala  Agalatheey pathutu Trailor pakuravanga like panunga,Positive ,joy
 Hindi movie pink. Remake to tamil. Good movie,Mixed_feelings ,joy
 Innum naraya naraya naraya  views....10m pothathu,Positive ,surprise
 Krish next part . Tamil la padam yaduthurukanga super,Positive ,joy
 Style kingna athu yapovum thalaivar mattumthn,Positive ,love
 Graphics sari illa nu solrathukune oru gang suthum parunga,Positive ,joy
 Nambukkitta kaadu eruntha eduthuppangha kaasu eruntha pudinguppanugha ana paddippa mattum epic dialogue,Positive ,love
 2:02 kandipa naa varama cinema theatreruku unna pakka🤞,Positive ,joy
 Chutiya Kat gya rajnikant ke fans ka. Views hi nai mile,not-Tamil ,love
 Yenda KRISH maska copi adichi vachirukkinga....!!🧐  Puthusa ethavathu design pannirukkalam...!,Mixed_feelings ,disgust
 Thala mass dialogue class vera level,Positive ,love
 Rajni Mass. Pakkathana poringa Kali oda aathatha. Sema Dialogue. Old Rajni is back,Positive ,love
 35k Anil kunjus found -disliked 🤣🤣,Negative ,joy
 Trending list la irundu poi again trending la varadu. First time seeing like this,Positive ,joy
 kola gagdla irruken....magane kollama vida matten.....Badsha 2.....,Positive ,anger
 Thala pola varuma  Thala eppavume mass Vera level,Positive ,love
 marning eluntha undan nera nkp trailer parka vantha angaali pangaali ellaam oru like podunga,Positive ,joy
" Нихрена себе!вот это индусы,вот это удивили, охренеть",not-Tamil ,neutral
 Thala masss yuvan bgm vera level,Mixed_feelings ,love
 Ide en inum trending la varla..? idha vda romba kammi views ruka videos lam trending la ruku,Positive ,love
 Sumara 50 times parthachu.one more trailer plzzzz,Positive ,surprise
 Enangada NKP theme music ah potu vachirukinga,Negative ,disgust
 Cast rajini nu pathil vera yarachum pannirukalam,Positive ,surprise
 Bigil vida indha trailer nalla irukae🤔🤔🤔,Positive ,joy
 Nee engitta vilayaada la yeman kitta,Positive ,joy
 Enna dhu Tamil cinema la vettu kutthu ilama oru padanum varatho,Positive ,joy
 Paaandeeee padam paaka vanthuratha theater ku fst day,Positive ,love
 Malayalam movie chinthamani kolacase njapakathukku varuth,Mixed_feelings ,disgust
 Really enjoyed ipotha thalaivaroda style nakkal ellathyum romba naaaluku aprm pakarom,Positive ,love
" Ippa inda SKfan ta enna solla poringa , commenters",Positive ,love
 Thalapathy 64 ku wait pandravaga like poduga,unknown_state ,joy
 Sk வுக்கு theme music வேண்டும் தல Yuvan! Title BGM Semma .,Positive ,love
 Nee yaaravenalum iru evanavennaalum iru ** THALA kitta thaiyae iru,Positive ,joy
 1:38  to  1:50 vera level,Positive ,love
 After syraa...seeing u sir ...4m Andra,unknown_state ,neutral
 Tamil cinema la itha vida pudhu storyline Vera ethuvum kidayathu,Negative ,disgust
 Karthi anna katta support from Kerala,Mixed_feelings ,neutral
 Movie pathutu trailer paakuravangalaan like podunga,Positive ,joy
 Money money money neraya neraya neraya massss,Positive ,love
 #Sl #boys  channel,Positive ,love
 Sema da.. Super machi. FDFS confirmed.,Positive ,disgust
 Rangaraj pandey fans hit like 🤣🤣🤣🤣,Positive ,love
 Aduchu Underwearoda odaa vitruvan.......... to viswasam,Mixed_feelings ,neutral
 ajith sir super act but kadai puthikala,Mixed_feelings ,joy
 Vera mathurii irukuuuu thalaivaaa..... Ni vah thalaivaaa vera Level expectations,Positive ,love
 Trailer la vara scens lam kanom,Positive ,love
 Gotha like kuda vanga mudiyala neeyalam enga annan thalapathy compateator poda aamai kunjugala poi   savunga da,Negative ,anger
 Thairiyama dewali Ku va thalaiva  nanga irukom irupom 🤗,unknown_state ,love
 Super star super star boos is bake,Positive ,joy
" school boys innum tution pogala pola,dislike button ah pudichu nonditu irukkanuga",Mixed_feelings ,joy
 Soori illama iruntha movie supper hit,Mixed_feelings ,neutral
 Kola gandu la irrikun padam paka.,Positive ,love
 Indha teaser Ku dislike pana avaga amma silku da,Positive ,joy
 Pandaee.... jii neega yepa padau nadika vantheenga.....,Positive ,joy
 I mena mukamudi padam mathiri iruku,Positive ,joy
 Trailer eh pathute irukunum pola solravanga like podunga,Positive ,joy
 Vijay sethupathi ku nalla role illa pola.... Apo padam nallaa irukaathunu thaan ninaiken,Negative ,joy
 Thungarthuku munnadi 1 time parpom,Positive ,surprise
 Asuran hit aagum nu ninaikuravanga like panunga,Positive ,joy
 30 million views varum nu soldravanga like potunga,Positive ,joy
 Yaaru da andha 9k dislikes uh,Positive ,joy
 O my god i love you #2.0,Positive ,love
 Kids : like Sivakarthikeyan Legends : like Action King ARJUN  ..,Positive ,joy
 Supar movie ......Thala sema supar.....u1 Bgm nice......,Positive ,joy
 Right now arun vijay in twitter :yaru ellam superhero padam nadakirathunu vivasthai illamal pochu,Mixed_feelings ,joy
 Salo Bollywood walo kuch sikho haramkhoro,not-Tamil ,neutral
 All thala fans comments pannunga..100k comments varanum,Positive ,love
 Semma. Padippu.  Mattu namma kitta erunthu etukka mudiyathu...,Positive ,surprise
 lets make it most liked video of youtube !!!,Mixed_feelings ,joy
 Last scene vera level love u thala,Positive ,love
 Adaei idhu Johnny quest music ila ?!?,Mixed_feelings ,neutral
 Action king Arjun fans Like Here,Positive ,love
 Manushan epudi vanthalum tharama irukaru ya... THALAAA... This time CLASSY After a MASS VISWASAM....,Positive ,love
 sivakumar ah villana potruklam just miss,Positive ,surprise
 Viswasam vs Petta pakalam yarru mass nu,Positive ,love
 U1 bgm Therikudhu.... Siva ku Nalla movie ya erukum... cameramen George c villiams SEMA,Positive ,joy
 Intha trailer ah daily pakaravanga .....?,Positive ,joy
 Enna da ithu trailer ah Serial ah,Negative ,anger
" Kerala ajit fans like ittu po, ejjathi item. Be ready makkale🤩🤩",Positive ,love
 Orutharmela neega viswasam MA erukarthuka Enaurutara a asigapadurega,Negative ,disgust
 Oru Vela ellam avan seyal padam maathiri irukkumo?,Positive ,joy
 Manju waarier looks like devashena u feel it guys,Mixed_feelings ,joy
 Theatre la pakura alavuku worth illa....suntv laye poduvan appa pathukuren,Mixed_feelings ,neutral
 Waste Moka nu solravanlam Moka pasanga moka movie paakuravanunga,Positive ,anger
 Avara control panunga pls semmmmmmmmaaaa mass,Positive ,love
 Ethana per vanthalum CHIYAAN tha maasss,Positive ,disgust
 Very good film after long time,Positive ,joy
 Thalapathy fans irukingla ..dislike panra kaaga ve vandhavanga ...,Positive ,love
 Amy Jackson pakka vanthaven la like  podunka,Positive ,joy
 Vera level trailer great job mr.vinoth,Positive ,love
 tmrw film release.. inikum trailer pakka vanthavinka yaru,Positive ,love
 Trending likes laam mukiyam Ila padamum acting yum dhan mukiyam theater la October 4  apo papinga,Positive ,joy
 Movie la ajithku theeni irukathu pola,Positive ,love
 Idha dhan pala varsham ah sollitu irukanga!!  Ini otrumai ah irukanum ellarum. . . Thala & Thalapathy fans!,Positive ,love
 Trailor pakkum munnadi kooda onnu thonala....trailor paatha aprm epoda paapomnu veri mandaikku eruthu............This trailor Advance booking for awards.....,Positive ,anger
 1:40 Vjs Jithu Laugh  Makkal Selvan  Forever,Negative ,anger
 After release # kaithi vera level #diwali winner,Positive ,love
 As Neelambari said In Padayappa Vayasu analo un  Stylum azhagum Une Vittu Pogala,Positive ,love
 vijay sethupathi nu oru nala actor irundhan ana avanum ipo poramboka maritan,Negative ,disgust
 ENNA DAA ELLAA  RECORDUKKUM SANGU  OODIDUVAANGA POLA    THALAIVAA   SUPER,Positive ,love
 Ayayo bigil aprm release panratha idea iruka lokesh gaaru 🤒🤒,Negative ,fear
 Nee vaa thala namma therikka viduvoom,Positive ,love
 U kena tunggu lama lagi utk tau saya,not-Tamil ,neutral
 ada paavi....appadiyae batman copy adichu vachirukingalae da,Positive ,disgust
 Daii ellam likes me comment pannunga da,Positive ,joy
 0:46 kathii trailer feeeel adichavange like......,unknown_state ,joy
 Thalaivar vera level!!! karthik subbaraj yenagaya iruntha ivalo naala.... 02:00 Kola gaandla irukkam mavaney kollama vidda mataen insaneeeee :P,Positive ,love
 Video pakaraduku munadi like panta..sama trailer,Mixed_feelings ,joy
 OK. expect panna levelku illa but ok,Positive ,love
 Siva sivan kjr hero trailer pakka Arjun arjunan ps hero mitran super  Saktimaan sakti 90#kids like and comment,Positive ,joy
 Elaam songs ku dhan addict aavaaanga... Naa enna yaa trailer ku laam addict aaitan.. Can't wait...,Positive ,surprise
 Semma semma semma semma thalaivar super star,Positive ,love
 Rajini+sankar+a.kumar+rahuman excellent job..waiting on screen thalivar fan..,Positive ,love
 Chinna payan konjam ovaru Ana trailer nalla irukku,Mixed_feelings ,disgust
 Alaguuuuuuuuuuuuuuuuuuu my one and only superstar rajinikanth sirree,Positive ,joy
 Bgm evanda pottadhu dsp paiyana irupaan pola veenaponavan,Negative ,disgust
 ivlo violence kandippa intha padathukku A certificate kodukkanum...intha padatha yaaru thalaila katta poraano thaanu..vaangura distributors ungalukku sangu thaandaa...soothanmaa irunthukunga..,Negative ,anger
 Black sheep kutty moonji vivek fans hite like,Positive ,love
 Orutharmela irukkura viswasatha kaatta innoruthara yen asingapaduthuringa.... Semma dialogue.... Verithanama waiting panren...,Positive ,love
 Bigil Left la poh ! Kaappaan Right la poh !,Positive ,surprise
 Vendum vendum asuran pola padam vendum ... Enpt vendam,Positive ,surprise
 Sema BGM Semaya erukkum padam waitingle veri yeruthe,Positive ,joy
 Othaaaaa poooluu mari iruku Graphics,Positive ,surprise
 V for vendetta dialogue  An idea can't be destroyed,Positive ,joy
 #VenkateshDaggubati74 Is Asuran Remake  All The Best Venky Sir,Positive ,joy
 OMG.... Thalaivar vera level..... Love you thalaiva...,Positive ,love
 Gud thaan..but Elam kolapura mathiri iruku..,Positive ,surprise
 Katha than mukkiyam ana trailer semma,Positive ,surprise
 Oru raksha illa Mone kaithiii uff,not-Tamil ,neutral
 Ivaru tha hero mathavanka LA zero va title yosika therila Ivan kuda action king vera pathu ena nadaka pokutho,Negative ,disgust
 Omg Yarellam Thala Ya Pakka Wait Panninga,Mixed_feelings ,neutral
 anikunju(vijay) movie oru naal rendu naala theatre la iruthu eduthuruvanuga conform intha movie release aana,unknown_state ,neutral
 Tik Tok Thala veriyan selvasaisaran,Positive ,surprise
 Thalaivaaaaaa. . . . Ne matum than nadigan ne matum than super star..,Mixed_feelings ,love
 Rajnikant sir toh din ba din jaban hote ja rehe he yar.....i love you rajni sir,not-Tamil ,love
 Is movi ka music bahut dasu hh jai asuran,not-Tamil ,neutral
 Diwali iku Meet panuvom bro bigil fans,unknown_state ,love
 Vera Vera Vera level doi mass  music Pakka,Positive ,love
 Movie Tamil memang best ...terbaik Ajith,Positive ,love
 1:42 noticed nee yaruda komali channel jainth,unknown_state ,neutral
 Video start aguradhuku munnadiye like poten  Happy to see Prakash Raj sir back,Positive ,joy
 Sweet saapda pooram  pongal vera lvl la erukkum,Positive ,surprise
 ಅಕ್ಷಯ್ ಕುಮಾರ್ ಅವರು ಭಾರತದ ರಿಯಲ್ ಸೂಪರ್ಸ್ಟಾರ್... ನಾನು ಅವರ ಯೂಮ್ಬ ದೊಡ್ಡ ಅಭಿಮಾನಿ..!,not-Tamil ,neutral
 Views got stuck on 70k,Mixed_feelings ,neutral
 Trailer marana mass FdFs poravanga therikkavidunga Saadha sk padam naale comedy yaathaan irukkum. Anna ithu different script. Next level Sk,Mixed_feelings ,love
 Racha rambola tala luv u from hyd,Positive ,love
 Bony kapoor🤣🤣 jyda paisa h mc to stok market me lga laudaa  typ ki movie h bc,unknown_state ,neutral
 Nerkonda Paarvai vs pink who is best?,Mixed_feelings ,neutral
 58k dislike pottavan tha kadasi vasanthuku vekka padanum,Positive ,joy
 Ayooo Thala lv u Thala. Sema mass Thala look  Sema. 🥰,Positive ,love
 I like karthick subburaj......direction...... karthick subburaj gets rocks,Mixed_feelings ,joy
 Sure blockbuster Congrats from thalapathy fans  Lokesh kanagaraj,Mixed_feelings ,love
 Enga thalaivar eppavumme masss  nu sollravanga mattum hit like pannitu ponga.......,Negative ,love
 Trialer super maran padam vettiri pera valthukal,Positive ,joy
 Thala indha look la semaya irukkaru 🤩🤩🤩,Positive ,joy
" Rasanai illadha pullingow, apdi enna korai ah kandu pudichitanga indha video lae dislike panra alavukku",Positive ,disgust
 Bigil  lavathu mairavathu Karthi in kaithi ya paaru da,unknown_state ,neutral
 U1 tharamana sambavam aug 10 apa papinga,Positive ,love
 Enna da trending laye kaanom ....,Positive ,surprise
 Rowdy ingala hero va katti vanmuraiya thundarady vetrimarnukku velaya pochi.Yevlo Enda nattukku thevayana Nalla karuthukala vachi flim edukalamla.,Negative ,disgust
 Thalaaa maranaaa masssss love u thalaaaa,Positive ,love
" Sad to say, but seems like rekka 2....hope I'm wrong!",Mixed_feelings ,joy
 U1 bgm vera level ..thala vera level acting,Positive ,love
 Scene like remake....from hindi movie PINK ....,Positive ,joy
 A MAGNUM OPUS SHORT FILM   FI SHORT FILM MAKING IN ZERO BUDGET,Negative ,anger
 Intha trailer la neega like rajini kaga pada venna oru tamilan padaippu kaga podunga ...,Mixed_feelings ,joy
 Unlike panradhukkune wait pannittu irundhurukkanunga 13k padunga,Negative ,joy
 Thalaivar style la sollanum na trailer WOW,Positive ,love
 Oruthan mela visvasatha katrathu kaga innorthara asinga paduthuringa,Positive ,love
 Enagada YouTube inum trending la add panama irukinga,Mixed_feelings ,neutral
 Sema masss Rajini & Vjs combo marana waiting,Negative ,love
 Objection enna voice paa marubadium pananum pola iruku,Positive ,anger
 Yarellam note paninga teejey movie la vandharunu 🤔🤔🤔🤔,Positive ,love
 THALA always masss.. Ippo sollava venum U1 music vera level ah irukkum...,Positive ,love
 En innum trending la varala? Ennada panringa YouTube fellows?,Mixed_feelings ,neutral
 Super video and super star mass,Positive ,love
 Thala look Vera level LA eruku,Positive ,love
 kaithi Diwali Super Hit Bigil Diwali Blockbuster,unknown_state ,joy
 Trending la namba Thala trailer thaa..num1...,Positive ,love
 Ranga Raj panday sir action super,Positive ,joy
 Dhanush Anna vera level u look awesome,Positive ,love
 Bollywood movie Pink remeke   lol,Mixed_feelings ,neutral
 Ajith Thalathala nu irukaru nalla gummunu,Positive ,joy
 thalaivaaa...enna ethu epdi chinna payyan mathiri...petta paraak,Positive ,love
 Entha padathile vikramkku robba dialogue s ellai,Positive ,joy
