text,category,emotion
 Viswasam bgm mathri iruku konjam enaku matum dha andha feel irukooo,Positive ,surprise
 Srk khan movie zero best tairlor,Positive ,surprise
 Bro enna bro ithu sema ge,not-Tamil ,joy
 adengapa innum nooru varsam alnalum thalaivar gethu than poga,Positive ,love
 Engada kanum enga thalaivana Vijay Sethupathi engal makkal selvatha kanum appuram enna maythukku ithu,Negative ,love
" Indha maadhri dhairiyasaalinga eppayaachu dhaa porappan, avana payanpaduthikravan dhaan buthisaali  Well said Our Dhanush- vetrimaraan combo is an example of this...",Positive ,surprise
 Ithuthaan thalaivar padam. Thalaivar mass. Romba nalaiku appuram oru tharamana Rajini sir parthuruken.,Positive ,love
 Enna bha trailer starting la Marvel lam varuthu,Positive ,joy
 10 vatti parthuten.. Thalaivar style ah parkkave... Mass thalaiva.... Music nalla irukku....,Positive ,love
 October release.. Aa.... November aachu daaa,Negative ,anger
 Matha movie vida super ahh erukum nunanaikaren..,Positive ,joy
 karthik suppuraj ni theivam ya sonnatha senjita ni thalaivar veriyan,Positive ,love
 Sankar sir ki oka like please,Mixed_feelings ,joy
 Oruthar mela visvasam katrathanala innorthar yen verukirigga.    Thala rocks,Positive ,surprise
 Vijay sethupathy Anna veriyan like here,unknown_state ,joy
 Oru varshathuku 10 padam edukura mudhal hero,Positive ,surprise
 Asuran movie vetri pera congratulation to thala fans,Positive ,love
 Yaralam viswasam side lenthu pett a side marninga comment panungo,unknown_state ,neutral
 Super thalaiva super. Unna eppadi pathu ronba nalachi. Weldon karthik suppuraj and petta team,Positive ,love
 Akshara Hasan... Acting is not ur thing.. SERIOUSLY!!!!!,Negative ,sadness
 Shakthi man nu sonna udane 90s kitnu niyabgham vanthavangha hit like,Positive ,joy
 Feel like yalam avan seiyal movie let see valthukal,Negative ,joy
" Petta semaya poingudhu ,poingalukku sweet tha..",Positive ,joy
 Endrum engala oraee Superstar ne than thalaivaaaaa,Positive ,love
 Enptku aprom petta nadichanga megha aksh pettaya rls aga poguthu enpt eppavo,unknown_state ,neutral
 Romba nal aparam ajith ah normal ah pakaran siva oda build up illama tharamana trailer.....,Positive ,surprise
 Sema  na inime sk fan,Positive ,love
 Thalaivar varoporaar......Jonjo odhingiru odi padhungiru varadhu thalaivar   PETTA PARAAK,Positive ,love
 chinna pasanga kuda imaiyamalai yen compare pandringa...!!,Positive ,disgust
 Kaithi vs Bigil vs SangaThamizhan,Positive ,love
 Super Talwar Chiyaan Vikram Marana mass,Positive ,love
 Viswasam sirutha Siva senjitaan who agree🤣🤣🤣🤣🤣🤣🤣🤣🤣🤣,Negative ,fear
 K ramachandran in 96 M g ramachandran,unknown_state ,neutral
 Thalaivar than massss evanalum Thalaivar itathai pitikka mutiyathu,Mixed_feelings ,love
 2:18 it reminds murattu kaala's rajini,Positive ,joy
" Thalaiva ungaluku vayase ahala thalaiva marana mass thalaiva, waitinglaye veriyahuthe",Positive ,love
 Enth look aado oru raksha ella,Positive ,joy
 Bgm kagava padathuku ponnum da yeppaaaaaa,Positive ,surprise
 1m likes vara varaikum very thanama than irupen,Positive ,joy
 Viswasam trailer  enga daaaww.... Kola veri la irukan,Positive ,surprise
 What ah speech Thala Ajith Kumar,Positive ,surprise
 Keladu punda magan ali punda ajith,Negative ,disgust
 Loving it is it going Hindi.,Positive ,surprise
 Dhepawali Ku release panna super iruguem,unknown_state ,joy
 पेट्टा पराक्....   सुपरस्टार्स रजीनीकांत 🤘,not-Tamil ,neutral
 Super ultimate star thala Ajith Kumar,Positive ,joy
 petta paraak last black shirt theriii thalaivaaa,Negative ,love
 International level ka film hai..Jisne dislike kiya hai woh Indian cinema ka dushman hai,not-Tamil ,love
 Vetri + Dhanush + GV Prakash +Trumpet BGM.,Positive ,love
 3dla  paakamalae ivlo nalla iruku appo 3Dla epdi irukum,Mixed_feelings ,joy
 thala sila per kasukaga yendha kadhayaiyum choose panni nadikuranga nee mattum dhan thala samuthayathu kaga nadikiringa vera level trailor,Positive ,love
 Kaithi Padam paathuttu nallarkkunu solravanga mattum like pannunga,Positive ,joy
 ee myran enthoru fans power aadey,Positive ,love
 Siva Anna super put not important,Mixed_feelings ,joy
 Zero faltu hain lekin 2.0 joss  hain,not-Tamil ,neutral
 Super super super tala tala tala,Positive ,joy
 thalaiva neenga eppoyem super star tha massss,Positive ,love
 Padam na idhu padam  mass,Positive ,love
 Knjam body maintain panna...inum nalla iruparu...,Mixed_feelings ,joy
 Mobile chor bna dala akki ko,not-Tamil ,neutral
 ultimate star thala fans like panunga,Positive ,love
" Theme music visvasam konjam pidsuru thattuthu ,,marrijavan ku mattum case pottinglaa ithukkum podunga da",Positive ,love
 Hindi  me kab a rha ha,not-Tamil ,neutral
 Thalaaaaa Semma trailer & new avatharam Ajith Sir,Positive ,joy
 Trailer Ku teaser paravala nanaikuravaga oru like poduga,Negative ,joy
 Thala fanz lam yenga poniga comments low ah agudu,Positive ,love
 Irumbhuthurai maari indha movie super block buster agumnu solluravanga like here,Mixed_feelings ,joy
 Apadiyalam nadakathu nadakavum kodathu mass scene,Positive ,love
" Innum neraya neraya nerya, neraya views varanum.... Thala Rock",Positive ,love
 Love ajith from andhra pradesh  &  karnataka,Positive ,love
 Intha mari pongalku la apdi tha nadakum...... “Apdila nadakathu - nadaka kudathu” love you thala,Positive ,love
 Eppadi Neraya Nereya Neraya THALA Sollum bodhu gooshbumbs ah Eruku....I love thala only,Positive ,love
 24k Potta pasanga vandhu paathutu poirkaanga,Negative ,sadness
" bhai gazab ab ye movie hila dega pure bollywood ko,,..",not-Tamil ,neutral
 Hey Vidya Bhalan engaya trailer full ah kanam,Positive ,joy
 Deiiii  ennada panni vachi irukeenga .....,Positive ,disgust
 3 Times kku mela pathavanga yarellam like pannunga,Negative ,joy
 I am andra ajith big fan bro,Positive ,love
 Intha dhesiya viruthu Award Asuranukku Than.kandipla.Mass Ah varom.,Positive ,love
 Avengers end game a keduthan ippa director pariu kuduka pooran,Negative ,anger
 Thalaivar enrum oruvar thaan avar Rajini Sir thaan.,Positive ,love
 11 maniku sollitu 10.30 ku vitanungaley,Positive ,surprise
 Dai intha mari padam already neraya paathachu,Positive ,love
 Aama Mr. Pandey inga enna panraru??,Positive ,joy
 Apa kandipa thalapathy 64 miratta podhu,Positive ,joy
 Vera level thalaivar tha eppavum mass,Positive ,love
 Innum one week trending la tha irrukanum,Positive ,joy
 Oonkala ennaku pittikoum but romba thabana time la movie vittuthinka,Negative ,anger
 Sathiyama solren!!!adichu underwearoda voda vitruven.pona manam thirupi varathu,Negative ,fear
 Semma mass ahh iruku padatha release pannunga pa Wait panna mutiyaala,Positive ,love
 Bahubali 2 Vs   2.0🤣🤣 Rajamouli.  Vs  Shankar Maragatha mani Vs A.R.Rahman,Mixed_feelings ,neutral
 Super  super  super  rajani  mass ssssssssssssssssssssssssssss,Positive ,love
 Again again trailer pathute commands padikuravanga oru like podunga,Positive ,joy
 Any PIGIL PANS... HIT LIKE....,unknown_state ,joy
" Evana pakka Chinna paiyan marri irukkan ,,,,,,F*** girl",Positive ,disgust
 Climax music kekkumpodhu appdiye goosebumps start aagudhu.... thanks Yuvan Annnnnnnnnnnnnna,Positive ,joy
 Pura aloga Chinta dhara ro cinema eta ku oscar trailer aka mili jiba kotha,Mixed_feelings ,disgust
" Thala king, getha vaa thala un rasikargal irukkanga",Positive ,surprise
 Trailer link ah  Therinjavanga ellarukum share pannunga fans,Positive ,love
 Anna nuvvu kottu super hit Ikkada andhraaaa Helo bros hit like here,unknown_state ,joy
 Hit like for Action King Arjun Sarja.,Positive ,joy
 Thalapathy fans yaaru nkp trailer pakka vantheenga,Positive ,love
 This is remake of pink hindi flim .... bigg boss abirami ka badhila tapsee ya vey potrkalam,Positive ,anger
 #Neraiya  #Neraiya #Neraiya  #Neraiya #Neraiya  Thadava paathavunga #Like Pannunga #Bss,Positive ,joy
 Phaa... Ithukey ipdinaaaa... Namba thalapathy ku epdi irukummmmm... Verithano verrithanooo,Mixed_feelings ,neutral
 794k likes first remake trailer getting this likes,Positive ,joy
 Vijay sethupathi ma ma mass da....,Positive ,love
 Screen play veramari iruku yedo iruku idula,Positive ,joy
 More than 20 times paathavanga mattum like pannunga..,Positive ,joy
 Rajini Rajini tha style style tha......,Positive ,joy
 Wow ...... Ye kadavula parthuta .. Yeppo periya screen la pappanu marana waiting,Positive ,joy
 Apdila nadakkathu nadakka kudathu lovely THALA,Positive ,love
 Suyama sindhika terinja ovoruthanum super hero mass ya yo?,Positive ,love
 ayyo chance ah illa.. thalaivar acting pudusu pusa irukkupa... vera yaarukum indha madri settagadhu.... adi poli... merattitinga,Positive ,love
 Last dialogue  its true.... Thala superb,Positive ,joy
 en thalaivan..engal thalaivan .nija vaalvilum avarai paarthavudan en kastangal panjai parandhu poividukiradhu..,Positive ,love
 Bgm ah enna da panni vachi erukega yelathuku semaah,Positive ,disgust
 Love u thalaaaaaaaaaaaaaaaa..... acting vera level Thala,Positive ,love
 Kola Gaandula irukken mavane odiru.. Phaah Dialogue delivery chancey illa..,Negative ,disgust
 rajini fans from Telugu states like here,Positive ,love
 Guyz support #2.0 India's pride,Positive ,love
 Views kammiya irukku yellaru parunga like pannunga...20m views avathu varanum...1m like varanum,Positive ,joy
" Yaar Enna sonnalum ,Thala dhaan mass. Inga neraya Peru Namma Poola Umbarathukune varanunga",Negative ,love
 All d best from all Kannadigas....,Positive ,love
 Hollowed level la iruka rompa ethir pakkalam Vikram acting vera level,Positive ,love
 Kalyani priyadarshan.. nammada kochine oru like adiche....,unknown_state ,disgust
" Hindi la amitabku fight illa, Tamil Ajith ku la fight irruku",Positive ,joy
" Ennada iron man elam vararu enya ildila pantringa ha ha ,,,",Mixed_feelings ,neutral
 Thala  oda lawyer acting ah pakka waiting ya..,Positive ,joy
 Last BGM IS DANGAL.  DANGAL  SONG,unknown_state ,neutral
 100k like masss thala va va va va enum va,Mixed_feelings ,love
 ajith fans kaaga dhan last dialogue.....,Positive ,love
 We want this movie in telugu,unknown_state ,neutral
 Dai antha vijay cmku aasapaduran .Aana en thala eppayumae mass da .,Negative ,love
 Adei.. stop begging for likes... Idiots..,Negative ,anger
 Thala fans anaivarum oru like podunga,Positive ,love
 Namata kadu iruntha eduthukiruvanunga Namata Kasu iruntha pudingikiruvanunga Ana padipu mattum nammakitta irunthu eduthakavemudiyathu............. Powerful dialogue,Positive ,love
 Yenda Thalapathy fans poole nereya peru umburinge,Negative ,love
 Hahaha poi bigil trailera paarungada🤭 vetti payalugala.,Negative ,disgust
 amaiku sangu confirmed adai Siva ha ha ha apidiye Feb odi poidu .. Illa 10 paisa paaka maata,Negative ,fear
 Deiii movie eppa da waiting laye veri aaguthu,Positive ,anger
 Thalaivan Verothanam Start Panntaru...Indha Diwali Nammaldhu Thalaivaa,Negative ,love
 Oruthar mela irukura visuvasathuku innoruthara yen asinga paduthiringa i think intha dialogue ellam fans kum suit agum,Positive ,love
 Sema pa trailer...inum neraiya neraiya neraiya neraiya thadava paknum pola iruku...!,Positive ,joy
 Thalaivaaa . . .. . . marana paa... .. . .,Positive ,love
 Amithapbachan padattai rajiniku piragu tala panrattu eppadi nenaikkiravanga like podunga,Positive ,joy
 Semma  THALA   veera  leveal   THALA,Positive ,surprise
 Padam nalla irukum yenna siva direct seiyala  aapppadi,Positive ,joy
 GREAT FILM   BEST DIRECTOR   WELL ACTOR   MASS PRODUCTION,Positive ,love
 Aiyoooo intha manusanuku unmaiyave age enna nu therila pa epadi irukaru Thalapathy fans verithanam,Negative ,love
 6 la irunthu 60 vara RAJINI RAJIAYAM.....,Positive ,surprise
 movie unlike adikunnadhu enthinanennariylla kandavarkkariyam movie ethra thrilling anennu,Negative ,joy
 Ippo sila paithiyanga like or comment nu kelambi irukumea,Mixed_feelings ,joy
 Ithu padam mathiri illa graphics mathiri irukku,Negative ,fear
 Rajini nale mass than pa,Positive ,love
 Dhanush + Vetrimaaran + GV,Positive ,joy
 Mrg elunthathum bathroom pohama pakravanga like podathinga.. Poi velaya parunga..,Positive ,anger
 thirunelveli enga thala yoda kotta daa,Positive ,surprise
 Ena da trailer ye mokka pundai ya iruku,Negative ,disgust
 Haa bhai kidr gye vo log jo bolre the teaser ghatiya hai iska VFX faltu hai issss flimmm ke,not-Tamil ,neutral
 Trailer maranna mass  thalaivar therika vidrarruuuu,Positive ,love
 I hate v... s...  Iron man kill it v... s,Negative ,sadness
 Rajini  sir Teaser Super.. indha pongalukku Petta than gethu....I like this Flim,Positive ,joy
 Yaru padam vanthalum varadum thanush Anna padam vanthale tamil nade miratdum by thanush veriyan,Positive ,love
 Sivakarthikeyan Telugu fans like,unknown_state ,love
 Telugu dhanush fans hit like here,Positive ,love
 Rajini super star next c m 2. 0  pe Super,Positive ,joy
 Rajini tha mass vj ajith lam tusu,Negative ,love
 Semmma maasss.. Thalaivar style.. .. Super thalaiva.. 🤘🤘,Positive ,love
 You kena tunggu lebih lama lagi untuk tosai...,not-Tamil ,neutral
 Dhanush vatri maraan fans like it,Positive ,love
 0:26 & 2:18 Goosebumps... Onre Onru Mattam... Thalaivar... Rajni,Positive ,love
 semma mass great Shankar sir super star rajini great,Positive ,love
 Kabhi kabhi to lagta hai south waalon ki language sikhlun.,not-Tamil ,neutral
 Our super hero siva anna forever,Mixed_feelings ,joy
 Intha acting ku thala ku Oscar award kadaikum,Mixed_feelings ,neutral
 Endha trailer  time sollamatte 200 time melle pathavange mattum like podunge,Positive ,joy
 Nee enna captain America va ?,Negative ,fear
 Bigil  Kaithi Yar yar 2 padathukume waiting,Negative ,joy
 H VINOTH  macha u athukkum mele,Positive ,love
 dislike because of rajini speech in thuthukudi,unknown_state ,joy
 G. V. Neenga music mattum pannunga thevaillama hero va nadikkathinga,Positive ,joy
 Thalaiva  Makkal selvan Annan,Positive ,love
 Ajith fans innum naraya naraya naraya trailer paakkanum...,Positive ,love
 Sammaya iruku!! Thalaya indha maari role la pakka dha nalla iruku romba naal kezhichi,Negative ,disgust
 #Yuvan Shankar Raja# Raja mean king .. you are the real bgm king  #Bgm Vera Vera Vera level yaa#,Positive ,love
 bgm terikkuthu ghibran   from 1:05,Positive ,surprise
 Semma style mass rajini is rock,Positive ,love
 Appadaaa... Oru wela Thala Fans Siva kita irundu thappichitanga.. 🤣🤣🤣🤣,Positive ,love
 Orutar mela visuwasam kaaturathukage innurature yen asinge paduturinge... semmmmmaaaaaa,Positive ,love
 Neraya Neraya Neraya Neraya kola mass thala,Positive ,love
 *tha.. VERA level...!  Saavardha irundhaalum Poraadi saavanum... Kaal la vizhundhu Saaga kudaadhu..!!! GOOSEBUMPS dailogue,Positive ,love
 Kaidhi oodha poran da vijay ku bhigilu va va va sanghu,Positive ,love
 Last dialogue semma  karthi Anna .... Nala panirukenga ....,Negative ,fear
 Itha trailer Ku dislike pannuraven girls ku against ta irupan pola.... You mom also girl..,Positive ,joy
 Theme pathutu thaan again paaka vanthan thala ya,Positive ,surprise
 Enna Da Hindi a paarthu trailer I kooda copy adichi irukaanunga,Mixed_feelings ,disgust
 padam vera level hit aagum nu solravanga hit like here,Mixed_feelings ,love
 Balaji shaktivel fans like ah poduga,Positive ,love
 Oruthar mele visvasam kattathukkake innoruthare yen asinga peduthirenge,Positive ,joy
 appo visuvasam  lolzzzzz rombo pavam ajith lolzzzzzzzzzzzzzzzzzzzzzzzzzzzzzzzzzzzzzzzzzzzz,Negative ,sadness
 savuratha irunthalum sanda pottu savanum sir payanthu kal la vilunthu sava kudathu sir... super dialogue,Positive ,joy
" Dislike potavangala *tha neengala manusangala ,",Negative ,joy
 Fight scenes &  bgm vera level nu soiluravaga ................,Positive ,love
 Asuran vettai aramam marana mass,Positive ,love
 Kamarajar ayya va tholvi adaiya vaitha tamilnadu thana ongkaluku last vara oru nalla thalaivar kuda vara mattan da,Negative ,love
 The word vera level thalaiva unaku vayase agadha paaaa,Mixed_feelings ,love
 Kola kandula irrukam veral level mass thalaiva,Negative ,love
 Ivaruku Intha vaisula agathu pola... Omg wattta a man thalivaaaaaaa,Positive ,love
 Thalapathy 64 kkaa vanthu intha trailer pathavanga vijay fans like podunga .........🤞,Negative ,love
 Vagina fanskala savunkada... Thalaivar Kodi parakura edathula Vera Evan kodida parakum,Negative ,love
 Nee va thala eppavum unaku viswasama irupom... love you thala,Positive ,love
 Aiiiii Black Sheep Ayaz  & kutty munji !! semme  ! valthukal,Positive ,surprise
 1st tym ungaal ipdi pakro Thala 🤘🤘,Positive ,joy
 Nerkonda parvai...  Sema sema sema trailer,Positive ,joy
" en cmnta evanum mathika porathula,so nice..",Positive ,joy
 Enagada ipdi padathula marana katu katirukinga,Positive ,love
 congrats chiyaan Anna I m thala fan,Positive ,love
 Yenna da last seen ha phone la potrite mode la yedutha maari irruku,Positive ,love
 Bollywood wale yaha hagne na aye,Negative ,anger
 Vera Vera Vera level!!!!!!  Umma!!!,Positive ,love
 copy bgm ...to malayalam film oppam,Negative ,fear
" omg, Indian filmmaking is so embarassing xD",Positive ,surprise
 Petta padam vettri pera Thalapathy rasigargalin valltukkal.. Endrum vettriye todarum..,Positive ,surprise
 Mass thailava bgm Vera level and dialogues semma,Mixed_feelings ,love
 Wow thalaivaaaa Vera Leval Teaser  Awards Eduthu Vaikadaaa Asuran Vararuu,Positive ,love
 Maranam dance thalaiva u r great,Positive ,love
 Enda en deivatha dislike pandringa thevudiya pasangala.yaru sottula manna pottaru . savungada prostitute pasangala,Negative ,anger
 Thalaivar pongal begins 🤘🤘 petta paraak,Positive ,love
 Thalaivaa kola mass Vera leavel,Positive ,love
 I don't know Tamil but I like Rajini. Super style.,Negative ,joy
 Kola kandula irukan movanaeee kollama Vida matan,Mixed_feelings ,neutral
 semmmaaaaa massssss trailer a summa verithanam.,Positive ,love
 Anyone still watching in may 2019?,unknown_state ,disgust
" Pink 73k likes only... But, NEER KONDA PAARVAI......AWESOME....",Positive ,joy
 Dhanush vera maari idhu veri maari,Positive ,joy
 Yanada....last la... Bigil ku ... Reply pana..maari irukayy 🤣🤣,Negative ,anger
" Sivakarthikeyan Anna real fan's her like ....,",Positive ,love
 THALAIVAAAA  VERA LEVEL YA,Mixed_feelings ,love
 Nice 🥰🥰🥰... But rekka... Sindupath Mari irukama iruntha seri,Mixed_feelings ,neutral
 Last word in Malay 'you kena tunggu lebih lama lagi untuk tosai',Positive ,surprise
 Morning lindhu trailer pathuttu yavalo comment like pathutte erukravange like podunge,Positive ,joy
 Dialog : க‌ல்வி mattum yaralum nammata eruthu aaduthuka mudiyathu.. Vera lvl,Positive ,love
" vera level thala, en channel ku oru sub podunga thala veriyarkala, ungaluku kodi nandrigal",unknown_state ,love
" thalaiva unna paathona uyir poiyudichu...yenna Mazz,yenna class,yenna style...RAJINISM CONFIRMED",Positive ,love
 Thalaivar      Veraaaaaaa level,Positive ,love
 Family yoda padam parka mudiyathu pola.....,Negative ,disgust
 Thala lookku sema mass nu soldravanga mattum oru like podunga,Positive ,love
 Wow semmaya iruku sk anna fans hit,Positive ,love
 Peeta best or visuwasam best peeta best na like pannuga visuwasam best na dislike pannuga,Positive ,joy
 pongalukku  petta paraak thaan thalaivaa back with bang,Mixed_feelings ,love
 Omg thalaivaar pandey erukaraa vera level la eruku padam,Positive ,love
 Petta  poteringala anna end lover kanti please anna,unknown_state ,love
 Shraddha shrinath fans from Karnataka hit like here.....,Positive ,love
 Hindi me kab release hoga plz comment,not-Tamil ,neutral
 tvaivaal aaaa aaaaaa vera level tvaivaal aaaa,Positive ,love
 Vera level Trailer  thala pola varuma  luv u thala .....,Positive ,love
 Rajini Sir and Nawaz Bhai! Can't wait!!!!!,Positive ,love
 Indha padam KGF vida semaiya irrukunu ninaykiravanga like podunga,Positive ,joy
 Ennaa daa sedhukki vechirukkeenga frame by frame...,Positive ,disgust
 After a long time Thalaivar look...yeppaa...semmaaa...  Vere leaveldialoge vere leavel  anirudh bgm vijaysethupathi..mass total.. petta.... kola mass...doiii...,Negative ,love
 Kola kandula irukan mavane kollama vidamatan hit like hera,Positive ,joy
 Trailer merala aticithookuthu ellar vayil veralavaikuthu,Positive ,love
 Bgm na idhan bgm. Yuvan on,Positive ,love
 Rissing Star SK eppavum Trending Star,Positive ,joy
 Awesome  Rajni na summa va,Positive ,joy
 unmiyana Thala fan like a potutu po,Mixed_feelings ,love
 Suyama sinthika therinjavan than MANITHAN. .....super hero illa sk. Ni seekrama  anchoring ku again vara pora..,Negative ,joy
 Super Shankar Sir Rajanikanth Sir All The Best Movie Team Waiting Movie From Pawankalyan Fans,Positive ,love
 தலைவா  Vera level Tha podra vediya,Positive ,love
 Paavam sk Anna last movie nalla pola intha movie hit aaganum ragavendhra swamy Kita vendikara,Negative ,joy
 Yow.. editor trailer yeh mukkavasi story solitiyeya...,Mixed_feelings ,neutral
 Sona time la trailer gethu bigil uuhhhuuuu sangu oothaaa,Positive ,love
 I'm vetrimaran fan padam semma irukkum,Positive ,love
 Massss vera level  ASURAN Panthayam adikum,Positive ,love
 Dhaush Nadipuku Intha padam Theeni podum nu ninaikuren,Positive ,love
" Padam trailer mooka, padamum waste Insulting amitab  Poi sethu thola da ajith sunni",Negative ,anger
 Really super epdiya ivlo irku 37 days la mudicha,Positive ,joy
 Action king mass hero   1990s kids yarelam avanga solunga avaru mass ahh illaiyanu,Positive ,love
 Bgm sounds like Va modhi paru theme from Nerkonda paarvai..,Positive ,joy
 Albod galbod tolvad eeafhta fsadi bangsudsev tonytwag fortesgte,not-Tamil ,neutral
 Telugu lo kuda release cheyavachhuga machha,unknown_state ,neutral
 Vjs poda iron man ah keduthavane loosu,Negative ,anger
 pangaaligala intha vegam paththaathu innum vegama likes ah therika vidunka,Positive ,joy
 Thalaivaaaaaaaa.. pakka mass. Invincible style samrat,Positive ,love
 Bgm like nkp theme va modhiparu🤔🤔,Negative ,joy
 32K Like Potavan Silukku Mavan,Negative ,joy
 Click like botton  Still repeat mode from 6pm,Positive ,joy
 #என்றும்_தலஅஜித் #NerkondapaarvaiTrailer Crossed 11 Million Views.,Positive ,joy
 Vera level mass mass ajithkumar,Positive ,love
 Ippadi  neraiya neraiya neraiya neraiya ....,Positive ,surprise
 Rajini screen la  semma jore ah irukaru super,Positive ,joy
 Padam Raava irukkum pola  best of luck Thanush,Positive ,love
 Thala rasigan in vayalur pudhunagar SHACKARSH,Positive ,love
 Vfx pathi ippo pesungada Hollywood sambranigala,Negative ,sadness
 Final dialogue  for both Thala & Thalapathy fans ku solirukaru pola...,Mixed_feelings ,love
 Marana mass trailer....... Trailer na ippadi irukanu,Positive ,love
 Challenge summa therikavidapothu Chiyaan fans like pannunka,Positive ,love
 Shankar sir we want anniyan 2,Negative ,sadness
 I'M WAITING SANKAR ANNNA NEXT ANNIYAN 2 DIRECTOR SHANKAR CHIYAAN VIKRAM FANS VERY SOON ATHUKKU ME LA,Positive ,love
 Vera Vera Vera level. Thalaivar maaaassss,Positive ,love
 Movie fullaa night la mattum shoot pannittanga pola...🤔,Mixed_feelings ,neutral
 Dislikes podura thevidiya kandara oooooooli pasangala,Negative ,joy
 Ghibran pundaya vitta ungalukku vera aale kedaika laya da.,Negative ,disgust
 NORTH OR SOUTH KGF IS THE BEST!!,Positive ,love
 SK Anna  sema Mass,Positive ,love
 Nalla thana da iruku..  yendaa veembuku nu dislike panringa..,Positive ,joy
" Malaysia Tamil fans waiting for Kadaram Kondan movie Chiyaan Vikram, Kamal Haasan fans hit like here",Positive ,love
 Inspector gadget movie pakkura pola iruku,Mixed_feelings ,neutral
 Waiting waiting waiting super star rajini kanth sir first days 4 time pakka waiting,unknown_state ,joy
 Har bar alag look yr ohsame only one man Vikram,not-Tamil ,neutral
 THALA semma MasSs Girls mukiyamana movie  don't miss,Positive ,love
 Ethu vera vera vera vera  level trilore,Positive ,love
 Good luck from THALAPATHY fans kerala,Mixed_feelings ,love
 thalapathi nadichaa veru sura Aana danush nadichaa asuraa da varuvaaru paaru,Positive ,love
 Superbbb Rajini 20 years Boy  telugu lo kuda Kavalli,Positive ,joy
" Nanum padipa eduthukalanu patha.Mandala yeramatengudhu, correct dhanush sir",Positive ,love
" Makkal : Rajini padam nadikiradha niruthu, illaina un dowser'a kilichi ammanama vitruvom, Maanam pona Arasiyal side'aey vara mudiyaadhu paathuko",Negative ,disgust
 Enna elavu da idhu .... indha karumathuka 500 kodi,Negative ,sadness
" Vikram, Surya, Dhanush... Ivanga moonu perukum oru hit theva paduthu 🤪🤒🤒🤒🤒🤒",Mixed_feelings ,neutral
" VIJAY SETHUPATHI POWER  19 VIEWS BUT,,,,,,,,,,,,,,,,,,,,,,,,, 185 LIKE",Positive ,joy
 Looks like hollywood James Bond... Movie. And vikram sir u r da best one in our tamil industry...,Positive ,joy
 adapaveegala ipdi nadikura manushana vachu flopah kodutheengalada .  ajith sir pls  choose new directors,Mixed_feelings ,neutral
 Thalai ku thalai poora Neraiya Neraiya Neraiya romdha Neraiya neracha mudi irruku,Negative ,sadness
" Kaadu iruntha eduthukuvanunga, kasu iruntha pudungikuvanunga, Ana padippa mattum orthankitta iruntha  edukka mudiyathu dialogue vera level",Positive ,love
 Mm mm kr kr haa ha ha haaa  haiyoo aiyo,not-Tamil ,neutral
 Ipa enna panna porom... Viral Aaka porommmmmmm,Positive ,joy
 No actor can replace like rajni sir,Positive ,joy
 Wow   Super Star  RajiniKanth Fan's  like Vesukondi   ట్రైలర్ అదిరింది,Positive ,love
 Vera level  la iruku  . . .  Inga konjam payama than iruku  . . Accept,Mixed_feelings ,love
 Tamil shankar.. Hindi rajkumar hirani...Telugu raja mouli... R tge best,Positive ,love
 Nala eruku nalatha eruku adaaa nalathayea eruku,Positive ,surprise
 Sweet sapda porom pongaluku  Petta parak,Mixed_feelings ,neutral
 Thalaaa  u r  great,Positive ,love
 Teaser super nu solra thalapathi rasikarkal like pannuga,Positive ,joy
 Vera level ..after long time  sk fans,Positive ,love
 R.I.P Enai Nokki Paayum Thotta,Positive ,love
 Climax scene la kan kalangunavanga like pannunga,Mixed_feelings ,joy
